"concept","word","country","gender","preference","id"
"Intercropping (with beans)","It Can Be Intercropped.","Uganda","Male","Preferred",1247
"Intercropping (with beans)","It Can Be Intercpropped","Uganda","Female","Preferred",1248
"Drought avoidance","It Takes Short Period O Harvest Only 6 Months","Uganda","Male","Preferred",1249
"Food and fodder","The Market Is Ready For The White Maize","Uganda","Male","Preferred",1250
"Intercropping (with beans)","It Puts Two Cobs And Gives Chance For Beans","Uganda","Female","Preferred",1251
"Resilience","Can Compete Even In Bad Conditions","Uganda","Female","Preferred",1252
"Resilience","Its Resistance To Drought And Diseases","Uganda","Female","Preferred",1253
"Livestock feed","It`S Good For Pigs And Chicken","Uganda","Male","Preferred",1254
"Intercropping (with beans)","Ut Puts On Two Maize Cobs","Uganda","Male","Preferred",1255
"Livestock feed","Because She Wants To Start Rearing Pigs","Uganda","Female","Preferred",1256
"Resilience","This Maize Variety Is Drought And Disease Resistant","Uganda","Male","Preferred",1257
"Home use","This Maize Variety Is Drought And Disease Resistant And Can Provide Food At Home","Uganda","Male","Preferred",1258
"Food and fodder","This Maize Variety Provides Feeds For Animals And Food To Humans","Uganda","Female","Preferred",1259
"Family nutrition","This Maize Variety Is Nutritious Especially When Feeding Children","Uganda","Female","Preferred",1260
"Drought avoidance","It Matures In 3 And A Ahalf Months.","Uganda","Female","Preferred",1261
"Intercropping (with beans)","It Can Be Intercropped.","Uganda","Female","Preferred",1262
"Family nutrition","It Has Vitamin A","Uganda","Male","Preferred",1263
"Drought avoidance","It Is Drought Resistant.","Uganda","Male","Preferred",1264
"Resilience","Its Drought Resistant","Uganda","Female","Preferred",1265
"Green maize","Ready Market Where I Stay","Uganda","Male","Preferred",1266
"Intercropping (with beans)","You Can Harvest More Than One Crop On The Same Piece Of Land At The Same Time","Uganda","Female","Preferred",1267
"Resilience","Its Drought Resistant","Uganda","Male","Preferred",1268
"Drought avoidance","We Usually Have Dry Seasons","Uganda","Male","Preferred",1269
"Drought avoidance","Resistant To Drought And Takes Little Time To Harvest","Uganda","Female","Preferred",1270
"Family nutrition","It Can Help My Children To Grow Well","Uganda","Male","Preferred",1271
"Green maize","Can Use The Leftovers For Animals And It`S Resistant To Drought","Uganda","Female","Preferred",1272
"Drought avoidance","It Takes 3.5Months To Be Harvested And Is Resistant To Drought And Diseases","Uganda","Male","Preferred",1273
"Family nutrition","It Has Vitamin A It Gives Sweet Taste Posho And Its Resistant To Drought","Uganda","Male","Preferred",1274
"Green maize","It Looked Good In It`S Big Size And Thick Green Colour Of The Leaves.","Uganda","Female","Preferred",1275
"Resilience","This Is Resilient To Drought And Diseases","Uganda","Female","Preferred",1276
"Family nutrition","This Maize Variety Is Nutritious With Vitamin A Components","Uganda","Male","Preferred",1277
"Resilience","This Maize Variety Yields Big Maize Cobs","Uganda","Male","Preferred",1278
"Livestock feed","This Maize Variety Provides Nutritious Feeds To Animals And Birds","Uganda","Female","Preferred",1279
"Intercropping (with beans)","This Maize Variety Yields Two Maize Cobs If Well Spaced","Uganda","Female","Preferred",1280
"Resilience","Drought Resistant","Uganda","Male","Preferred",1281
"Home use","It Takes Long Without Rotting","Uganda","Male","Preferred",1282
"Drought avoidance","It Matures So Fast","Uganda","Female","Preferred",1283
"Resilience","It Is Drought Resistant.","Uganda","Male","Preferred",1284
"Family nutrition","It Has Vitamin A","Uganda","Female","Preferred",1285
"Drought avoidance","It Matures In 3 And A Half Months.","Uganda","Male","Preferred",1286
"Home use","It Lasts For Six Months","Uganda","Female","Preferred",1287
"Intercropping (with beans)","This Maize Variety Can Be Intercropped To Get Maize And Beans","Uganda","Male","Preferred",1288
"Resilience","This Maize Variety Requires Less Fertilizers And Can Do Well In Less Fertile Soils","Uganda","Female","Preferred",1289
"Drought avoidance","This Maize Variety Is Drought Resistant And Grows Within Three Months And A Half","Uganda","Male","Preferred",1290
"Intercropping (with beans)","This Maize Variety Can Be Intercropped Basing On The Season","Uganda","Female","Preferred",1291
"Green maize","It Grows Fast It Can Be Sold As Green Maize And The Dried One Can Be Still Sold","Uganda","Female","Preferred",1292
"Home use","It`S Hard Kernel Which Enables Its Grains Fo Last Longer","Uganda","Male","Preferred",1293
"Intercropping (with beans)","Because It Allows Hed To Mix It With Maize And Puts On Two Maize Cobs","Uganda","Female","Preferred",1294
"Resilience","That If It`S Well Managed It Means That He Will Harvest Much From It Since Its Resilient To Drought And Diseases .","Uganda","Male","Preferred",1295
"Resilience","Resistant To Drought And Can Do In Bad Soils","Uganda","Male","Preferred",1296
"Intercropping (with beans)","Helps On Small Land","Uganda","Male","Preferred",1297
"Drought avoidance","Drought Resistant And Has Short Period Of Harvest","Uganda","Female","Preferred",1298
"Drought avoidance","It Takes 3.5 Months Only Meaning Quick Money","Uganda","Female","Preferred",1299
"Intercropping (with beans)","It Gives Two Cobs","Uganda","Female","Preferred",1300
"Drought avoidance","It Is Drought Resistant","Uganda","Male","Preferred",1301
"Home use","It Does Not Require Alot Of Care According To How It Was Explained","Uganda","Male","Preferred",1302
"Drought avoidance","It Is Drought Resistant And It Takes A Shorter Time To Harvest","Uganda","Female","Preferred",1303
"Green maize","I Can Store It For Long When It Is Not Spoilt","Uganda","Male","Preferred",1304
"Family nutrition","Because It Has Vitamin A Which Is Good On Children.","Uganda","Male","Preferred",1305
"Food and fodder","Because It Is For Both Home Use And Animals.","Uganda","Male","Preferred",1306
"Resilience","Because It Is Resistant To Diseases And Drought.","Uganda","Male","Preferred",1307
"Drought avoidance","Because It Is Resistant To Drought And Diseases.","Uganda","Female","Preferred",1308
"Resilience","Because The Soil At The Respondents Is Not Very Fertile Also Prone To Drought And Disease Conditions","Uganda","Male","Preferred",1309
"Drought avoidance","Because Its Matures Faster Especially  There Is Alot Of Drought This Season","Uganda","Female","Preferred",1310
"Intercropping (with beans)","Because Its Profitable  The Maize Is White And Marketable","Uganda","Male","Preferred",1311
"Resilience","Because It Survives All Harsh Conditions","Uganda","Female","Preferred",1312
"Intercropping (with beans)","You Get To Harvest Both Maize And Beans","Uganda","Female","Preferred",1313
"Livestock feed","Because It Is Good On Animals And Birds.","Uganda","Female","Preferred",1314
"Drought avoidance","This Season Is Too Hot With Little Rain","Uganda","Female","Preferred",1315
"Resilience","It Is Drought Resistant","Uganda","Female","Preferred",1316
"Intercropping (with beans)","When I Intercrope With Other Crops Like Beansthe Harvest Is Still High","Uganda","Female","Preferred",1317
"Drought avoidance","It Takesa Few Months To Haverst","Uganda","Male","Preferred",1318
"Drought avoidance","3 Months Harvest And It Stands Against Drought","Uganda","Female","Preferred",1319
"Intercropping (with beans)","My Land Is Small So Growing This Same Variety Like Mine Can Be Helpful","Uganda","Male","Preferred",1320
"Intercropping (with beans)","This Maize Variety Can Yield Two Maize Cobs Due To The Big Spacing","Uganda","Male","Preferred",1321
"Intercropping (with beans)","This Maize Variety Can Be Intercropped And Can Yield Two Maize Cobs If Well Spaced","Uganda","Male","Preferred",1322
"Drought avoidance","This Maize Variety Is Drought Resistant","Uganda","Female","Preferred",1323
"Family nutrition","This Maize Variety Is Yields Big Maize Cobs","Uganda","Female","Preferred",1324
"Family nutrition","It Has Vitamin A","Uganda","Female","Preferred",1325
"Resilience","It`S Resistant To Hash Conditions","Uganda","Female","Preferred",1326
"Green maize","Can Eat It Fres And Has Nutrients","Uganda","Male","Preferred",1327
"Resilience","Resistant To All Bad Conditions","Uganda","Male","Preferred",1328
"Drought avoidance","Because It Grows Faster Taking 3.5Months","Uganda","Male","Preferred",1329
"Drought avoidance","Its Resistant To Drought And Diseases And Grows Faster","Uganda","Male","Preferred",1330
"Green maize","It Has No Gaps Which Leads To More Yields","Uganda","Female","Preferred",1331
"Intercropping (with beans)","Because It Produces Two Maize Cobs On Each Plant","Uganda","Female","Preferred",1332
"Food and fodder","Its Leftover Materials Can Be Fed To Animals.","Uganda","Male","Preferred",1333
"Drought avoidance","It Matures In 110 Days.","Uganda","Male","Preferred",1334
"Resilience","It Is Disease Resistant .","Uganda","Female","Preferred",1335
"Drought avoidance","It Matures In 3 And A Half Months.","Uganda","Female","Preferred",1336
"Resilience","Its Drought Resistant","Uganda","Male","Preferred",1337
"Resilience","It Can Work Well Even In Less Fertile Soils","Uganda","Male","Preferred",1338
"Intercropping (with beans)","Gives Two Cobs","Uganda","Female","Preferred",1339
"Drought avoidance","Its Drought Resistant It Matures So Fast Ie 3.5 Months","Uganda","Female","Preferred",1340
"Resilience","This Maize Variety Is Disease Resistant","Uganda","Female","Preferred",1341
"Drought avoidance","This Maize Variety Is Requires Usual Fertilizers","Uganda","Male","Preferred",1342
"Resilience","This Maize Variety Is Resistant To Diseases And Requires Little Fertilizers","Uganda","Female","Preferred",1343
"Intercropping (with beans)","This Maize Variety Requires Little Fertilizers","Uganda","Male","Preferred",1344
"Family nutrition","It Has Vitamin A","Uganda","Female","Preferred",1345
"Resilience","It Is Drought Resistant.","Uganda","Male","Preferred",1346
"Drought avoidance","It Matures In 3 And A Half Months.","Uganda","Female","Preferred",1347
"Intercropping (with beans)","It Produces Two Long Cobs.","Uganda","Male","Preferred",1348
"Home use","Because It Can Be Stored For A Long Period Of Time","Uganda","Male","Preferred",1349
"Intercropping (with beans)","Because It Allows Her Mix With Beans And All Grows Well Since She A Small Piece Of Land For Farming","Uganda","Female","Preferred",1350
"Green maize","It Has A Big Maize Cob","Uganda","Female","Preferred",1351
"Home use","It Can Be Stored For A Long Time Without Making Losses","Uganda","Male","Preferred",1352
"Resilience","Its Drought And Disease Resistant And Can Work In Less Fertile Soils","Uganda","Female","Preferred",1353
"Family nutrition","It Has Vitamin A Good For Childrens Growth","Uganda","Male","Preferred",1354
"Home use","It Takes Long Without Rotting","Uganda","Female","Preferred",1355
"Drought avoidance","It Takes Less Time To Be Yielded Thus Making Sales So Fast.","Uganda","Male","Preferred",1356
"Food and fodder","It Has The Same Market And Dry Leftovers Can Feed Animals","Uganda","Male","Preferred",1357
"Home use","Can Be Stored For Long Periods","Uganda","Female","Preferred",1358
"Resilience","Resistant To Diseases","Uganda","Female","Preferred",1359
"Family nutrition","It Has Vitamins And The Cob Is Compact Compared To Ours","Uganda","Male","Preferred",1360
"Home use","Because It Has Astrong Seed Cover Which Can Help You Keep It For Over Six Monthsit Is","Uganda","Female","Preferred",1361
"Intercropping (with beans)","You Can Grwo Both Beans And Maize On A Same Plot","Uganda","Female","Preferred",1362
"Drought avoidance","It Grows Faster","Uganda","Female","Preferred",1363
"Green maize","Because It Can Be Inter Cropped","Uganda","Male","Preferred",1364
"Food and fodder","Because It Takes Shorter Period To Harvest","Uganda","Male","Preferred",1365
"Family nutrition","Because It Has Vitamin A","Uganda","Female","Preferred",1366
"Resilience","Being Disease Resistant.","Uganda","Female","Preferred",1367
"Resilience","Being Drought And Disease Resistant.","Uganda","Male","Preferred",1368
"Intercropping (with beans)","It Can Be Intercropped With Other Crops And Still One Makes Good Outputs.","Uganda","Female","Preferred",1369
"Green maize","Produces Big Seed It`S Sweet And It Has Market.","Uganda","Male","Preferred",1370
"Home use","Can Be Stored For A Long Time And Be Sold At Good Prices.","Uganda","Female","Preferred",1371
"Family nutrition","Because It Has Vitamin A","Uganda","Male","Preferred",1372
"Food and fodder","It`S Food For Both Humans And Animals.","Uganda","Male","Preferred",1373
"Resilience","Being Drought Resistant And Requires Application Of Less .","Uganda","Male","Preferred",1374
"Intercropping (with beans)","It Produces Two Maize Corbs Per Plant.","Uganda","Female","Preferred",1375
"Resilience","Grows Fast","Uganda","Female","Preferred",1376
"Home use","Stored For Long Time And Sweet","Uganda","Male","Preferred",1377
"Drought avoidance","Drought Resistant","Uganda","Male","Preferred",1378
"Intercropping (with beans)","I Have Limmitted Land So Intercropping Helps To Harvest Beans And Maize At Once","Uganda","Female","Preferred",1379
"Home use","It Can Be Stored For Six Months Without Rotting","Uganda","Male","Preferred",1380
"Green maize","Can Be Sold Fresh Hence Better Returns","Uganda","Male","Preferred",1381
"Drought avoidance","With Limited Rainfall Can Do Well","Uganda","Male","Preferred",1382
"Home use","Because It Is Sweet","Uganda","Female","Preferred",1383
"Resilience","Drought Resistant","Uganda","Female","Preferred",1384
"Intercropping (with beans)","Two Maize Corns","Uganda","Female","Preferred",1385
"Resilience","Not Prone To Pests And Diseases","Uganda","Male","Preferred",1386
"Home use","Sweet Posho","Uganda","Female","Preferred",1387
"Drought avoidance","Because It Takes Shorter Period To Harvest","Uganda","Male","Preferred",1388
"Intercropping (with beans)","Because It Can Be Intercropped With Beans And Still Gives High Yeilds Of Maize","Uganda","Female","Preferred",1389
"Food and fodder","Because It Can Be Eaten By Both Man And Animals","Uganda","Female","Preferred",1390
"Home use","Because It Can Be Kept Up To Six Months Without Getting Spoilt By Weevils","Uganda","Male","Preferred",1391
"Family nutrition","Because Its Big And It Also Contains Vitamin A","Uganda","Female","Preferred",1392
"Livestock feed","Because It Can Be Planted Together With Beans And Also It Yields Two Maize Corns On Each Plant","Uganda","Male","Preferred",1393
"Resilience","Because It Is Resirient To Both Drought And Diseases","Uganda","Male","Preferred",1394
"Home use","Because It Has Strong Kernel Which Helps Us To Keep The Maize For Long","Uganda","Male","Preferred",1395
"Food and fodder","Because It Is For Both Human Consuption And The Forage Is Used For Animal Feeds","Uganda","Female","Preferred",1396
"Resilience","It Is Resistance To Both Drought And Diseases","Uganda","Male","Preferred",1397
"Intercropping (with beans)","It Is White In Colour It Gives High And Bi And Long Con Maize And It Can Give Two Cons On One Plant","Uganda","Female","Preferred",1398
"Home use","The Fact That It Has The Stronger Kernel Which Helps Us To Keep The Maize For Longer Period","Uganda","Female","Preferred",1399
"Resilience","It Is Both Drought And Disease Resistance And It Grows In Low Fertile Soils","Uganda","Female","Preferred",1400
"Resilience","Itnis White And Not Yellow And So It Has Market","Uganda","Male","Preferred",1401
"Intercropping (with beans)","It Yields Bigger Maize Cones According To What I See In The Photo","Uganda","Male","Preferred",1402
"Drought avoidance","It Yields Faster","Uganda","Female","Preferred",1403
"Resilience","It Is Resistant To All Conditions And It Yields More Than What We Have Been Growing","Uganda","Male","Preferred",1404
"Resilience","Because The Land Has Depleted In Nutirents And Less Rain","Uganda","Female","Preferred",1405
"Drought avoidance","Because It Grows Fast And Drought Resistant Since There Are Low Rains This Season","Uganda","Female","Preferred",1406
"Intercropping (with beans)","Better Yields Are Bee Of Spacing","Uganda","Female","Preferred",1407
"Family nutrition","Because It Improves The Health Of The Family","Uganda","Female","Preferred",1408
"Family nutrition","Because It Has Vitamin A Which Is Good To Children.","Uganda","Female","Preferred",1409
"Drought avoidance","Its Drought Resistant And Has A Shorter Period To Harvest","Uganda","Male","Preferred",1410
"Intercropping (with beans)","Yields For More Than One Crops Gained","Uganda","Male","Preferred",1411
"Drought avoidance","It Yields In Three Months And It Can Easily Gain Market","Uganda","Female","Preferred",1412
"Family nutrition","It Can Be Markateble In Schools","Uganda","Male","Preferred",1413
"Drought avoidance","It Can Help In Seasons Of Unpredictable Rains","Uganda","Male","Preferred",1414
"Family nutrition","It Has Market In Schools","Uganda","Male","Preferred",1415
"Drought avoidance","The Harvest Is In 3 Months And Half","Uganda","Female","Preferred",1416
"Green maize","Because It Is For Home Consumption.","Uganda","Female","Preferred",1417
"Drought avoidance","Because It Grows Very Fast And Resistant To Drought And Diseases.","Uganda","Male","Preferred",1418
"Home use","Because It Takes Long In Storage Without Getting Bad.","Uganda","Female","Preferred",1419
"Green maize","Because It Has A Long Cob.","Uganda","Male","Preferred",1420
"Drought avoidance","It Is Drought And It Yields Faster","Uganda","Male","Preferred",1421
"Intercropping (with beans)","It Yields Two Maize Cones Per Plant","Uganda","Female","Preferred",1422
"Resilience","It Is Resistant To Drought Pests And Infertile Land","Uganda","Male","Preferred",1423
"Intercropping (with beans)","If You Intercrop It With Beans It Yields More","Uganda","Female","Preferred",1424
"Home use","Because One Can Easily Sell And Eat The Sweet Food Market Is Available Every Where","Uganda","Female","Preferred",1425
"Resilience","Because Yields In 4 Months","Uganda","Male","Preferred",1426
"Family nutrition","Because The Respondent Has A Young Family To Kerp Healthy","Uganda","Female","Preferred",1427
"Drought avoidance","It Is Disease And Drought Resistant","Uganda","Male","Preferred",1428
"Drought avoidance","Early Harvest And Disease Free And Drought Resistant","Uganda","Male","Preferred",1429
"Green maize","You Can Sell It Raw","Uganda","Male","Preferred",1430
"Family nutrition","It Has Vitamin A For Children","Uganda","Male","Preferred",1431
"Home use","Kept For 6 Months With Out Weavils","Uganda","Female","Preferred",1432
"Family nutrition","Because It Has Vitamin A Which Is Good On Children.","Uganda","Female","Preferred",1433
"Intercropping (with beans)","Because It Saves Space And Also Crops Come Out Well Even Though Intercropped.","Uganda","Female","Preferred",1434
"Food and fodder","Because It Is For Both Home Consumption And Animals.","Uganda","Male","Preferred",1435
"Drought avoidance","Because It Is Both Drought And Disease Resistant.","Uganda","Male","Preferred",1436
"Home use","To Feed My Family And Sell","Uganda","Female","Preferred",1437
"Intercropping (with beans)","It Yields Well Even When You Mix With Other Varieties Therefore A Better Harvest Of More Crops On The Same Garden","Uganda","Female","Preferred",1438
"Resilience","Its Resilient To Pests And Drought","Uganda","Male","Preferred",1439
"Drought avoidance","It Stands Against Drought","Uganda","Female","Preferred",1440
"Drought avoidance","It Yields Faster","Uganda","Female","Preferred",1441
"Resilience","It Is Resistant To Poor Land And Drought","Uganda","Female","Preferred",1442
"Resilience","It Is Resistant To All Conditions","Uganda","Female","Preferred",1443
"Home use","It Is Drought Resistant And It Can Be Stored For Long Without Getting Spoilt","Uganda","Male","Preferred",1444
"Food and fodder","Because It Can Be Sold And Eaten By Both Animals And Human Beings.","Uganda","Male","Preferred",1445
"Green maize","It Is Resistant To Drought.","Uganda","Male","Preferred",1446
"Drought avoidance","Because It Is Resistant To Diseases And Takes A Shorter Period To Be Harvested.","Uganda","Female","Preferred",1447
"Family nutrition","Because It Has Vitamin A Which Is Good On Children.","Uganda","Female","Preferred",1448
"Drought avoidance","It Has A Shorter Harvest Period","Uganda","Male","Preferred",1449
"Resilience","It Stands All Around Against Droughtpestsdiseases And Poor Soils","Uganda","Female","Preferred",1450
"Intercropping (with beans)","It Can Be Helpful When You Have Small Piece Of Land","Uganda","Female","Preferred",1451
"Drought avoidance","It Matures Fast And It Has Market","Uganda","Female","Preferred",1452
"Intercropping (with beans)","Because Of Intercropping With Other Crops And All Comes Out Well.","Uganda","Male","Preferred",1453
"Drought avoidance","It Has Shorter Maturing Period","Uganda","Male","Preferred",1454
"Resilience","Because The Seasons Are Unpredictable","Uganda","Female","Preferred",1455
"Resilience","It Is Resistant To All Conditions","Uganda","Male","Preferred",1456
"Green maize","It Profits Farmers Early Because Its Sold Raw","Uganda","Male","Preferred",1457
"Drought avoidance","Because It Is Drought And Disease Resistant","Uganda","Male","Preferred",1458
"Resilience","Because Its Withstands Harsh Conditions Ie Bad Weather Diseases","Uganda","Male","Preferred",1459
"Resilience","It Withstands All Bad Conditions Ie Less Fertile Soils Drought And Diseases","Uganda","Female","Preferred",1460
"Food and fodder","Because It Can Be For Both Home And Animal Consumption.","Uganda","Male","Preferred",1461
"Drought avoidance","Because It Is Resistant To Diseases And Drought.","Uganda","Male","Preferred",1462
"Resilience","Because It Is Resistant To Drought And Diseases.","Uganda","Male","Preferred",1463
"Home use","Because It Is For Both Home And Animal Consumption.","Uganda","Male","Preferred",1464
"Resilience","Because The Respondents Land Is Less Fertile Has Lunyo Prone To Maize Diseases And Drought","Uganda","Female","Preferred",1465
"Intercropping (with beans)","Helps Especially Those With Small Pieces Of Land Grow More Crops","Uganda","Female","Preferred",1466
"Drought avoidance","Because It Matures Fast Hence Profits To The Farmer Are Realised Early","Uganda","Male","Preferred",1467
"Resilience","Because Of The Frequent Seasonal Changes","Uganda","Male","Preferred",1468
"Family nutrition","It Produces Nutritious Food","Uganda","Female","Preferred",1469
"Livestock feed","It Is For Animals And I Have Pigs And Hens At My Farm","Uganda","Female","Preferred",1470
"Intercropping (with beans)","It Can Be Intercropped With Beans","Uganda","Male","Preferred",1471
"Home use","It Can Be Stored For Six Months Whwn It Has Not Got Spoilt","Uganda","Female","Preferred",1472
"Home use","It Has Market Since Its For Food And Home Consuption","Uganda","Female","Preferred",1473
"Green maize","It Can Be Easily Sold And Food At Home","Uganda","Female","Preferred",1474
"Resilience","You Can Be Sure Of A Good Harvest Because Of Its Resistance To Many Obstacles Like Pestspoor Soils And Diseases","Uganda","Male","Preferred",1475
"Intercropping (with beans)","I Use This Variety Of Intercroping Though This One Has A Slight Difference","Uganda","Male","Preferred",1476
"Food and fodder","Because It Can Serve Both Humans And Animals","Uganda","Male","Preferred",1477
"Drought avoidance","Because It Is Resistant To Drought And Diseases.","Uganda","Female","Preferred",1478
"Drought avoidance","It Is Drought Resistant","Uganda","Female","Preferred",1479
"Resilience","It Can Stand Dry Seasons And Not Enough Rains","Uganda","Female","Preferred",1480
"Food and fodder","Because It Is Gor Both Home Consumption And Animals.","Uganda","Male","Preferred",1481
"Intercropping (with beans)","Because It Can Be Intercropped With Other Crops.","Uganda","Female","Preferred",1482
"Family nutrition","Because It Has Vitamin A.","Uganda","Female","Preferred",1483
"Home use","Because It For Both Selling And Home Consumption.","Uganda","Male","Preferred",1484
"Livestock feed","Because The Respondent Rears Animals.","Uganda","Female","Preferred",1485
"Home use","Because It Is For Home Use And Marketable Easily","Uganda","Male","Preferred",1486
"Green maize","Because It Suits The Market","Uganda","Male","Preferred",1487
"Intercropping (with beans)","Its The One The Respondent Usually Grows Yields Well And Its What He Shall Grow This Season","Uganda","Male","Preferred",1488
"Drought avoidance","Its For Food And Can Be Sold","Uganda","Male","Preferred",1489
"Home use","For Food At Home And Selling","Uganda","Female","Preferred",1490
"Home use","For Food And Selling","Uganda","Male","Preferred",1491
"Drought avoidance","Because Its Harvest Is In Three And A Half Months","Uganda","Female","Preferred",1492
"Green maize","When It Yields It Has No Gaps On The Cones","Uganda","Female","Preferred",1493
"Resilience","It Is Resistant To Exhausted Land And Pests","Uganda","Male","Preferred",1494
"Green maize","It Yields Two Maize Cones Per Plant","Uganda","Male","Preferred",1495
"Resilience","It Is Resistant To Infertile Land","Uganda","Female","Preferred",1496
"Intercropping (with beans)","It Can Be Intercropped With And Better Utilize A Small Piece Of Land","Uganda","Male","Preferred",1497
"Resilience","Because This Area Is Prone To Alot Of Drought","Uganda","Female","Preferred",1498
"Food and fodder","Because It Is For Home Consumption And Also Cattle.","Uganda","Female","Preferred",1499
"Home use","It Can Feed Usthe Same Time Sell It And Its White","Uganda","Female","Preferred",1500
"Resilience","It Is Drought Resistant.","Uganda","Male","Preferred",1501
"Home use","It Lasts For 6 Months.","Uganda","Female","Preferred",1502
