"concept","word","country","gender","preference","id"
"Green maize","Because it needs fertilisers","Kenya","Female","LessPreferred",2513
"Intercropping (with beans)","Same with what the farmer plants at home","Kenya","Male","LessPreferred",2514
"Resilience","Low yield","Kenya","Female","LessPreferred",2515
"Green maize","Only taste, and no guaranteed yields","Kenya","Female","LessPreferred",2516
"Food and fodder","No reason","Kenya","Female","LessPreferred",2517
"Family nutrition","Cannot withstand drought and poor soils in the area like the other two","Kenya","Female","LessPreferred",2518
"Resilience","Lower yields when rains are adequate","Kenya","Male","LessPreferred",2519
"Green maize","Challenging to find market for green maize","Kenya","Female","LessPreferred",2520
"Family nutrition","Small grains","Kenya","Female","LessPreferred",2521
"Livestock feed","Not clear about its market","Kenya","Male","LessPreferred",2522
"Green maize","Fear of theft from others because of location of farm","Kenya","Male","LessPreferred",2523
"Livestock feed","Few number of cattle","Kenya","Female","LessPreferred",2524
"Home use","Low production","Kenya","Male","LessPreferred",2525
"Resilience","Low yields during harvesting","Kenya","Female","LessPreferred",2526
"Green maize","It`s mainly grown for sale, while the farmer prefers seed variety mainly for consumption","Kenya","Male","LessPreferred",2527
"Home use","It gives average yields","Kenya","Male","LessPreferred",2528
"Drought avoidance","It produces Low yields","Kenya","Female","LessPreferred",2529
"Livestock feed","It has a low resistance to pests and diseases","Kenya","Male","LessPreferred",2530
"Family nutrition","It`s not a high drought resistance variety","Kenya","Female","LessPreferred",2531
"Livestock feed","The benefits are less.","Kenya","Male","LessPreferred",2532
"Home use","It has less benefits compared to the variety usually used.","Kenya","Female","LessPreferred",2533
"Family nutrition","The uses are similar with other varieties in the market.","Kenya","Male","LessPreferred",2534
"Livestock feed","Has no pigs and chicken to feed the produce and no market for the produce,.","Kenya","Male","LessPreferred",2535
"Drought avoidance","Because it is low yielding","Kenya","Male","LessPreferred",2536
"Resilience","It is not good","Kenya","Female","LessPreferred",2537
"Livestock feed","Because it can only be used as animal feed and the farmer does not have many cattle to feed","Kenya","Male","LessPreferred",2538
"Livestock feed","Because it can only be used as animal feed","Kenya","Male","LessPreferred",2539
"Family nutrition","Because it has low yields during periods when it is affected by diseases and drought","Kenya","Male","LessPreferred",2540
"Intercropping (with beans)","Requires large size of land to plant enough crops","Kenya","Female","LessPreferred",2541
"Green maize","No food for children","Kenya","Female","LessPreferred",2542
"Livestock feed","No ready market for the grains","Kenya","Male","LessPreferred",2543
"Family nutrition","Unattractive color","Kenya","Male","LessPreferred",2544
"Drought avoidance","Early harvesting can bring problems with neighbors, lower harvests","Kenya","Female","LessPreferred",2545
"Resilience","Not sure if it will not be affected by pests","Kenya","Female","LessPreferred",2546
"Green maize","Fear of theft","Kenya","Female","LessPreferred",2547
"Livestock feed","Family first","Kenya","Male","LessPreferred",2548
"Food and fodder","Not that important","Kenya","Male","LessPreferred",2549
"Livestock feed","Has no cattle","Kenya","Female","LessPreferred",2550
"Livestock feed","Because this variety can only be used in livestock but we don`t keep the pigs and chicken at home.","Kenya","Male","LessPreferred",2551
"Intercropping (with beans)","Because it has no difference with my normal seed variety.","Kenya","Female","LessPreferred",2552
"Green maize","P","Kenya","Male","LessPreferred",2553
"Family nutrition","No clear explanation whether it important to adults as well","Kenya","Male","LessPreferred",2554
"Livestock feed","It`s only used for animal feeds","Kenya","Female","LessPreferred",2555
"Green maize","Not interested in selling the maize, just in need of home consumption varieties","Kenya","Female","LessPreferred",2556
"Food and fodder","Less productive compared to the varieties in the market","Kenya","Male","LessPreferred",2557
"Livestock feed","Limited usage: feed","Kenya","Male","LessPreferred",2558
"Home use","Normal variety that is vulnerable to diseases and pests","Kenya","Male","LessPreferred",2559
"Drought avoidance","Low yields","Kenya","Male","LessPreferred",2560
"Livestock feed","The variety is not widely accepted in the market thus can`t fetch good money for the farmer.","Kenya","Female","LessPreferred",2561
"Home use","The variety only does well in sufficient conditions","Kenya","Female","LessPreferred",2562
"Intercropping (with beans)","The variety requires wide spacing when intercroped hence low yield.","Kenya","Male","LessPreferred",2563
"Intercropping (with beans)","The variety has low yield","Kenya","Female","LessPreferred",2564
"Home use","The variety takes longer time to mature","Kenya","Male","LessPreferred",2565
"Livestock feed","Demand is low in their village","Kenya","Female","LessPreferred",2566
"Intercropping (with beans)","Low production","Kenya","Female","LessPreferred",2567
"Home use","It`s same with what they usually plant","Kenya","Male","LessPreferred",2568
"Green maize","Low income","Kenya","Female","LessPreferred",2569
"Food and fodder","It`s has same purpose as with he usually plants","Kenya","Male","LessPreferred",2570
"Home use","Mostly it`s for home use, would like an all purpose variety.","Kenya","Male","LessPreferred",2571
"Livestock feed","Majors on feeding livestock","Kenya","Female","LessPreferred",2572
"Green maize","Hard to get market for green maize.","Kenya","Female","LessPreferred",2573
"Livestock feed","This variety talks more about livestock. We need more for food varieties.","Kenya","Female","LessPreferred",2574
"Intercropping (with beans)","Almost the same as mine.","Kenya","Female","LessPreferred",2575
"Livestock feed","I don`t rear livestock for commercial use","Kenya","Female","LessPreferred",2576
"Family nutrition","It is not highly productive compared to others","Kenya","Male","LessPreferred",2577
"Green maize","It has less production","Kenya","Male","LessPreferred",2578
"Home use","It`s mainly for home use purposes","Kenya","Male","LessPreferred",2579
"Family nutrition","I could not compare","Kenya","Male","LessPreferred",2580
"Resilience","It is not palatable","Kenya","Female","LessPreferred",2581
"Food and fodder","Will produce high yields","Kenya","Male","LessPreferred",2582
"Green maize","The colour is not good. The taste is not good.","Kenya","Male","LessPreferred",2583
"Intercropping (with beans)","It requires large spaces and low yields","Kenya","Male","LessPreferred",2584
"Drought avoidance","It has low harvest.","Kenya","Female","LessPreferred",2585
"Food and fodder","It can fail to get to dry maize for home consumption","Kenya","Male","LessPreferred",2586
"Family nutrition","Only suitable to those doing large livestock keeping","Kenya","Male","LessPreferred",2587
"Livestock feed","It is only used for livestock which are not main focus of the respondent","Kenya","Male","LessPreferred",2588
"Family nutrition","Kids doesn`t like the colour of maize and its mostly good when green while the respondent needed maize for making flour","Kenya","Female","LessPreferred",2589
"Food and fodder","The respondent doesn`t have livestock hence no need for the variety","Kenya","Female","LessPreferred",2590
"Livestock feed","No market for the produce in their locality.","Kenya","Male","LessPreferred",2591
"Food and fodder","Its only for livestock feeds","Kenya","Male","LessPreferred",2592
"Food and fodder","She got no livestock hence she didnt like it.","Kenya","Female","LessPreferred",2593
"Livestock feed","It is for livestock feeds only.","Kenya","Male","LessPreferred",2594
"Green maize","It doesnt dry for harvest and use in future.","Kenya","Female","LessPreferred",2595
"Resilience","May not be good when rainfall isn`t well distributed","Kenya","Male","LessPreferred",2596
"Green maize","I can get green maize from any variety","Kenya","Female","LessPreferred",2597
"Family nutrition","Has no market due to it orange colour","Kenya","Female","LessPreferred",2598
"Intercropping (with beans)","It is susceptible to diseases and drought","Kenya","Female","LessPreferred",2599
"Family nutrition","It`s production is greatly reduced by drought and diseases","Kenya","Male","LessPreferred",2600
"Home use","Cannot be used to feed livestocks","Kenya","Female","LessPreferred",2601
"Green maize","It cannot be dried and used for ugali","Kenya","Female","LessPreferred",2602
"Family nutrition","It doesn`t have ready market","Kenya","Female","LessPreferred",2603
"Home use","It cannot be used as animals feed","Kenya","Female","LessPreferred",2604
"Family nutrition","It`s ability to resist drought and diseases is moderate","Kenya","Female","LessPreferred",2605
"Green maize","Does not like to sell green maize","Kenya","Male","LessPreferred",2606
"Drought avoidance","If you dont have enough fertiliser you wont get enough harvest","Kenya","Male","LessPreferred",2607
"Green maize","The market for green maize is not good as everyone will have green maize.market is good while its dried grain","Kenya","Male","LessPreferred",2608
"Family nutrition","The colour might reduce its market.","Kenya","Female","LessPreferred",2609
"Livestock feed","It is limited to those who are more interested in livestock farming","Kenya","Female","LessPreferred",2610
"Drought avoidance","Little harvest is realised because of shorter maturity period","Kenya","Female","LessPreferred",2611
"Home use","He wants multipurpose variety that also be used for other uses","Kenya","Male","LessPreferred",2612
"Livestock feed","No much interest| he doesn`t rear livestock feeding on it","Kenya","Male","LessPreferred",2613
"Family nutrition","Can not be sold to meet other house needs as the demand is low","Kenya","Male","LessPreferred",2614
"Food and fodder","Not so interested with animal feeding food security first","Kenya","Male","LessPreferred",2615
"Livestock feed","It`s less resistant to drought hence cannot do well in the area","Kenya","Male","LessPreferred",2616
"Green maize","It cannot be used as livestock feed","Kenya","Female","LessPreferred",2617
"Livestock feed","The colour is not appealing to me","Kenya","Female","LessPreferred",2618
"Resilience","It is not good for intercropping","Kenya","Male","LessPreferred",2619
"Livestock feed","It requires more fertiliser","Kenya","Male","LessPreferred",2620
"Green maize","Green maize is not a favourite meal in my household, and is not marketable in this area","Kenya","Female","LessPreferred",2621
"Food and fodder","Not very resistant to diseases and drought","Kenya","Male","LessPreferred",2622
"Intercropping (with beans)","Wide spacing due to intercropped crops means low grain yields","Kenya","Male","LessPreferred",2623
"Green maize","Maize variety is not suitable for Maize flour, which is the staple food in this area","Kenya","Female","LessPreferred",2624
"Family nutrition","Colour of flour is not my favourite","Kenya","Female","LessPreferred",2625
"Family nutrition","Getting it`s market is difficult in this area","Kenya","Female","LessPreferred",2626
"Green maize","They like dry maize","Kenya","Female","LessPreferred",2627
"Livestock feed","It`s only useful to livestocks and requires much fertiliser","Kenya","Male","LessPreferred",2628
"Home use","It cannot be stored for more than 6 months","Kenya","Male","LessPreferred",2629
"Food and fodder","It uses much fertiliser","Kenya","Male","LessPreferred",2630
"Livestock feed","Lands are small and its not a priority to plant livestock feed","Kenya","Male","LessPreferred",2631
"Livestock feed","Not interested in a variety that is livestock based.","Kenya","Female","LessPreferred",2632
"Green maize","Not interested in a green maize variety| it might lead to losses when it is not sold while dried.","Kenya","Female","LessPreferred",2633
"Family nutrition","There is nutritional value in other varieties planted.","Kenya","Female","LessPreferred",2634
"Drought avoidance","It has low yield.","Kenya","Male","LessPreferred",2635
"Green maize","It may not be favourable for drying","Kenya","Female","LessPreferred",2636
"Family nutrition","He`s not sure if Can be intercropped with other plants, is interested in diversified production","Kenya","Male","LessPreferred",2637
"Livestock feed","Has no interest with rearing livestock","Kenya","Male","LessPreferred",2638
"Green maize","Not so much interested in green maize productivity","Kenya","Female","LessPreferred",2639
"Livestock feed","She is not livestock farmer, not so much interested","Kenya","Female","LessPreferred",2640
"Family nutrition","No ready market because yellow colour","Kenya","Female","LessPreferred",2641
"Food and fodder","Duration in the farm is a bit longer","Kenya","Male","LessPreferred",2642
"Livestock feed","Have not ventured so much into livestock production.","Kenya","Male","LessPreferred",2643
"Green maize","It is long hence can fall in presence of wind","Kenya","Female","LessPreferred",2644
"Green maize","Green maize is prone to theft, and it can not be stored for longer use period","Kenya","Female","LessPreferred",2645
"Drought avoidance","This variety can not be intercropped with other crops","Kenya","Female","LessPreferred",2646
"Livestock feed","This variety does not secure my family food needs","Kenya","Male","LessPreferred",2647
"Livestock feed","High fertilizer requirements","Kenya","Male","LessPreferred",2648
"Green maize","Green maize can not be stored for lengthy use","Kenya","Female","LessPreferred",2649
"Livestock feed","Higher fertilizer requirements","Kenya","Male","LessPreferred",2650
"Food and fodder","Not interested in livestock production","Kenya","Female","LessPreferred",2651
"Livestock feed","It has less benefits compared to the other two","Kenya","Male","LessPreferred",2652
"Drought avoidance","Takes longer to mature.","Kenya","Female","LessPreferred",2653
"Livestock feed","The yellow colour is not pleasing especially for home use","Kenya","Male","LessPreferred",2654
"Green maize","Not interested in sale and production of green maize.","Kenya","Male","LessPreferred",2655
"Drought avoidance","They usually plant maize during rain season","Kenya","Male","LessPreferred",2656
"Livestock feed","They don`t have pigs that will benefit","Kenya","Male","LessPreferred",2657
"Family nutrition","Getting its market is inconvenient","Kenya","Male","LessPreferred",2658
"Green maize","It limits the farmer since it needs a ready market","Kenya","Female","LessPreferred",2659
"Livestock feed","It`s only useful to those with cattle and pigs","Kenya","Female","LessPreferred",2660
"Food and fodder","Food is the first priority in my household`s first priority. I feel this variety can not provide enough food for my family","Kenya","Male","LessPreferred",2661
"Family nutrition","The yellow colour of the variety is not marketable in this area","Kenya","Male","LessPreferred",2662
"Livestock feed","High fertilizer requirements","Kenya","Female","LessPreferred",2663
"Green maize","Green maize is not suitable for the market here","Kenya","Male","LessPreferred",2664
"Livestock feed","High fertilizer requirements","Kenya","Male","LessPreferred",2665
"Intercropping (with beans)","Beans makes the maize weak when intercropped","Kenya","Female","LessPreferred",2666
"Resilience","The weather is unpredictable nowadays hence this variety might not do well in the area","Kenya","Male","LessPreferred",2667
"Drought avoidance","It`s not suitable for livestock fodder","Kenya","Male","LessPreferred",2668
"Family nutrition","We don`t like ugali from yellow maize","Kenya","Female","LessPreferred",2669
"Green maize","The green variety is hard to store hence the family may lack food in a very short period of time It requires more fertiliser","Kenya","Female","LessPreferred",2670
"Livestock feed","No markets readily available as it`s not loved by many people","Kenya","Female","LessPreferred",2671
"Family nutrition","Yellow in colour, one eats ugali from yellow variety at their home","Kenya","Male","LessPreferred",2672
"Intercropping (with beans)","It`s not nutritious hence not preferred by her","Kenya","Female","LessPreferred",2673
"Livestock feed","She can use as food as well as animal feed","Kenya","Female","LessPreferred",2674
"Home use","Same as what he has been planting","Kenya","Male","LessPreferred",2675
"Food and fodder","The variety is less resilient against diseases","Kenya","Male","LessPreferred",2676
"Livestock feed","The farmer has a small farm hence preferes planting maize variety suitable for use as food","Kenya","Male","LessPreferred",2677
"Intercropping (with beans)","The variety has less plants per acre due to intercroping","Kenya","Male","LessPreferred",2678
"Food and fodder","The variety is less resistant to drought","Kenya","Male","LessPreferred",2679
"Intercropping (with beans)","The variety has relatively less plants per acre","Kenya","Female","LessPreferred",2680
"Green maize","Can be finished by the children, because its only consumed when green.","Kenya","Female","LessPreferred",2681
"Livestock feed","Because it has no market and the children doesn`t like it.","Kenya","Female","LessPreferred",2682
"Livestock feed","It has low ability to resist drought diseases.","Kenya","Male","LessPreferred",2683
"Intercropping (with beans)","The variety produces weak stems which can`t withstand strong wind","Kenya","Male","LessPreferred",2684
"Food and fodder","Because I don`t keep any cows at home,","Kenya","Female","LessPreferred",2685
"Green maize","It`s value is more attached to it while still green, this might cause hunger by the harvesting time.","Kenya","Female","LessPreferred",2686
"Livestock feed","I prefer a variety that focuses more on children welfare.","Kenya","Female","LessPreferred",2687
"Green maize","I don`t like the green maize business.My main goal is to have enough food for my family first.","Kenya","Female","LessPreferred",2688
"Family nutrition","Mostly focuses on feeding the household and for sale. I need a variety that majors more on livestock.","Kenya","Male","LessPreferred",2689
"Intercropping (with beans)","Takes a lot of space in the farm| my farm is very small","Kenya","Male","LessPreferred",2690
"Food and fodder","It does not perform well during drought season","Kenya","Female","LessPreferred",2691
"Home use","Similar to the variety she usually plant","Kenya","Female","LessPreferred",2692
"Green maize","Loss incase lack of market","Kenya","Male","LessPreferred",2693
"Food and fodder","Same as the variety usually planted","Kenya","Male","LessPreferred",2694
"Livestock feed","Still livestock can use intercropping variety","Kenya","Female","LessPreferred",2695
"Livestock feed","Small sizes of land just for food production, not feed","Kenya","Male","LessPreferred",2696
"Green maize","Unavailability of market","Kenya","Male","LessPreferred",2697
"Green maize","Attracts pests","Kenya","Male","LessPreferred",2698
"Livestock feed","Mainly for livestock","Kenya","Female","LessPreferred",2699
"Home use","Its a normal variety","Kenya","Female","LessPreferred",2700
"Drought avoidance","The variety has low yields. The rains rarely fails so the variety can cause loss of harvest.","Kenya","Male","LessPreferred",2701
"Livestock feed","It is yellow in colour.","Kenya","Female","LessPreferred",2702
"Food and fodder","I do not have livestock to feed the fodder to.","Kenya","Female","LessPreferred",2703
"Green maize","It has no market. The dried maize is more marketable.","Kenya","Male","LessPreferred",2704
"Drought avoidance","It has low grain harvest.","Kenya","Male","LessPreferred",2705
"Family nutrition","No reason","Kenya","Female","LessPreferred",2706
"Family nutrition","If the rains fail there is no expected yields.","Kenya","Female","LessPreferred",2707
"Intercropping (with beans)","Resistant to diseases and drought is medium.","Kenya","Female","LessPreferred",2708
"Home use","It is not resistant to crop diseases.","Kenya","Male","LessPreferred",2709
"Livestock feed","The respondent is not interested in poultry or pig (livestock) farming and thus finds no positive trait to the feed variety","Kenya","Female","LessPreferred",2710
"Livestock feed","It is majorly for livestock while respondent`s main purpose for farming maize is home consumption","Kenya","Male","LessPreferred",2711
"Drought avoidance","It needs much fertiliser","Kenya","Female","LessPreferred",2712
"Livestock feed","It is only for livestock feeding yet tge respondent is More concerned about food for his household","Kenya","Male","LessPreferred",2713
"Drought avoidance","Here we don`t have extreme drought season","Kenya","Female","LessPreferred",2714
"Family nutrition","Nothing","Kenya","Male","LessPreferred",2715
"Livestock feed","Because my main challenge in my household is food not livestock feed","Kenya","Male","LessPreferred",2716
"Family nutrition","No explanation","Kenya","Male","LessPreferred",2717
"Green maize","I am used to farming maize for dry produce The market for green maize is usually overflooded","Kenya","Female","LessPreferred",2718
"Green maize","My main target is to have enough grains that will ensure enough food supply at home but not the green maize","Kenya","Male","LessPreferred",2719
"Livestock feed","Is only ideal for livestock consumption and I might not get its market","Kenya","Female","LessPreferred",2720
"Livestock feed","Has high fertiliser requirements and it is not resilient to drought and diseases","Kenya","Female","LessPreferred",2721
"Drought avoidance","Has low yield compared to others","Kenya","Male","LessPreferred",2722
"Green maize","Is not resilient to drought and diseases","Kenya","Female","LessPreferred",2723
"Livestock feed","It is not easy to get ready market for the variety in his locality.","Kenya","Male","LessPreferred",2724
"Food and fodder","The respondent is not interested with growing animals feed","Kenya","Male","LessPreferred",2725
"Food and fodder","The farmer has a few livestock to feed","Kenya","Male","LessPreferred",2726
"Drought avoidance","The seed concept variety gives Low yields","Kenya","Female","LessPreferred",2727
"Livestock feed","It`s only used for animal feeds","Kenya","Male","LessPreferred",2728
"Intercropping (with beans)","The seed concept variety produces overall low yields","Kenya","Female","LessPreferred",2729
"Green maize","It`s mainly grown for sale while the farmer prefers variety that is used for consumption","Kenya","Female","LessPreferred",2730
"Green maize","Because it has yield loses during dry seasons","Kenya","Female","LessPreferred",2731
"Food and fodder","Because it can be used as animal feed and the farmer doesn`t have many animals to feed","Kenya","Female","LessPreferred",2732
"Livestock feed","It`s only used as animal feed which is not a priority to the farmer","Kenya","Female","LessPreferred",2733
"Home use","The farmer is not able to meet the fertiliser need of the variety","Kenya","Male","LessPreferred",2734
"Green maize","Because it cannot be intercropped with beans","Kenya","Female","LessPreferred",2735
"Livestock feed","Prefers variety that produces both food and animal feed.","Kenya","Male","LessPreferred",2736
"Food and fodder","Could prefer to try it later seasons","Kenya","Female","LessPreferred",2737
"Livestock feed","Prefers variety which gives both home use food and animal feeds","Kenya","Female","LessPreferred",2738
"Green maize","No market for green produce and prefers dry maize","Kenya","Female","LessPreferred",2739
"Intercropping (with beans)","Similar to the variety usually planted","Kenya","Male","LessPreferred",2740
"Drought avoidance","Low production","Kenya","Male","LessPreferred",2741
"Green maize","Only for roasting","Kenya","Male","LessPreferred",2742
"Resilience","Average output","Kenya","Male","LessPreferred",2743
"Green maize","White maize can still substitute green maize","Kenya","Male","LessPreferred",2744
"Resilience","Low production","Kenya","Male","LessPreferred",2745
"Intercropping (with beans)","Requires large spacing and separating of crops","Kenya","Male","LessPreferred",2746
"Livestock feed","Currently, I dont have livestock","Kenya","Female","LessPreferred",2747
"Food and fodder","Preparing animal feed is difficult for me","Kenya","Female","LessPreferred",2748
"Intercropping (with beans)","Requires a different planting style than what we know","Kenya","Male","LessPreferred",2749
"Livestock feed","No reason","Kenya","Female","LessPreferred",2750
"Family nutrition","Supplements can be bought|priority is a variety with a good market.","Kenya","Male","LessPreferred",2751
"Food and fodder","Not interested in commercial livestock farming.","Kenya","Male","LessPreferred",2752
"Drought avoidance","It has not explained about the nutrition content.","Kenya","Female","LessPreferred",2753
"Resilience","Its yield is similar with planned variety.","Kenya","Male","LessPreferred",2754
"Green maize","May lead to losses as most will be consumed and finished in the field.","Kenya","Female","LessPreferred",2755
"Family nutrition","It is not drought resistant The fertiliser requirement is high","Kenya","Female","LessPreferred",2756
"Intercropping (with beans)","Intercropping with beans is a risk because of the unpredictable weather","Kenya","Male","LessPreferred",2757
"Livestock feed","It can not be used as human food","Kenya","Male","LessPreferred",2758
"Intercropping (with beans)","It requires more fertiliser","Kenya","Male","LessPreferred",2759
"Green maize","They like dry maize which can be grinded","Kenya","Female","LessPreferred",2760
