"concept","word","country","gender","preference","id"
"Livestock feed","Uses high amount of fertilizers.","Kenya","Female","LessPreferred",3491
"Livestock feed","It is only for livestock feeds.","Kenya","Male","LessPreferred",3492
"Intercropping (with beans)","It is similar to the variety they have been planting.","Kenya","Male","LessPreferred",3493
"Home use","N/A","Kenya","Female","LessPreferred",3494
"Family nutrition","It has a yellow colour","Kenya","Female","LessPreferred",3495
"Intercropping (with beans)","It is similar to what I plant","Kenya","Female","LessPreferred",3496
"Home use","I have no reason","Kenya","Male","LessPreferred",3497
"Family nutrition","It requires more management in terms of fertiliser and disease management","Kenya","Male","LessPreferred",3498
"Livestock feed","It is yellow in color and is only for feeding livestock","Kenya","Male","LessPreferred",3499
"Family nutrition","Due to it`s colour there is no market","Kenya","Female","LessPreferred",3500
"Green maize","The seed size is small","Kenya","Male","LessPreferred",3501
"Food and fodder","Similar to the variety usually planted","Kenya","Female","LessPreferred",3502
"Green maize","Prefers dry maize for consumption,no market for green maize.","Kenya","Male","LessPreferred",3503
"Family nutrition","Similar to the variety used here","Kenya","Female","LessPreferred",3504
"Livestock feed","High fertilizer use","Kenya","Female","LessPreferred",3505
"Family nutrition","The farmer doesn`t like the colour of the maize","Kenya","Male","LessPreferred",3506
"Livestock feed","It has low market demand in the farmer`s area of residence","Kenya","Female","LessPreferred",3507
"Home use","Because it is sweet and can be consumed early before it is dry hence the farmer will not get dry grain","Kenya","Female","LessPreferred",3508
"Food and fodder","Because it doesn`t do well under dry conditions","Kenya","Male","LessPreferred",3509
"Home use","Because the farmer will consume all in a very short time since it is sweet leaving the farmer with no dry grains","Kenya","Male","LessPreferred",3510
"Livestock feed","Food comes first before animals","Kenya","Male","LessPreferred",3511
"Green maize","Prefer dry maize","Kenya","Female","LessPreferred",3512
"Food and fodder","In case of low rainfall, there is no possibility of crop loss","Kenya","Female","LessPreferred",3513
"Family nutrition","Has doubts about nutritional content","Kenya","Female","LessPreferred",3514
"Intercropping (with beans)","Labour intensive in terms of cultivating","Kenya","Male","LessPreferred",3515
"Resilience","No reason","Kenya","Female","LessPreferred",3516
"Livestock feed","Susceptible to diseases","Kenya","Female","LessPreferred",3517
"Home use","Cannot be given to livestock","Kenya","Male","LessPreferred",3518
"Drought avoidance","Our area does not experience drought seasons","Kenya","Male","LessPreferred",3519
"Resilience","No reason","Kenya","Female","LessPreferred",3520
"Drought avoidance","It gives low yields","Kenya","Male","LessPreferred",3521
"Livestock feed","It`s only meant for animal feeds","Kenya","Female","LessPreferred",3522
"Green maize","It`s mainly grown for sale while the farmer prefers a seed variety for consumption","Kenya","Male","LessPreferred",3523
"Livestock feed","It requires a lot of fertiliser to mature","Kenya","Male","LessPreferred",3524
"Home use","It requires a larger amount of fertiliser to mature","Kenya","Male","LessPreferred",3525
"Livestock feed","Low resistance to drought and diseases","Kenya","Female","LessPreferred",3526
"Family nutrition","The yellow colour reduces its market demand.","Kenya","Male","LessPreferred",3527
"Food and fodder","This variety can`t withstand prolonged drought and diseases.","Kenya","Female","LessPreferred",3528
"Resilience","It`s not highly drought resistant as compared to the other varieties.","Kenya","Male","LessPreferred",3529
"Green maize","This variety has low market demand.","Kenya","Male","LessPreferred",3530
"Home use","Vulnerable to diseases","Kenya","Male","LessPreferred",3531
"Livestock feed","Not interested in animal husbandry","Kenya","Male","LessPreferred",3532
"Livestock feed","Mainly meant for livestock, yet there`s need to improve household food security","Kenya","Female","LessPreferred",3533
"Green maize","Mainly meant for commercial purposes","Kenya","Female","LessPreferred",3534
"Home use","Less productive during less rains","Kenya","Male","LessPreferred",3535
"Food and fodder","Not resistance to drought","Kenya","Female","LessPreferred",3536
"Green maize","Needs ready market","Kenya","Female","LessPreferred",3537
"Food and fodder","It`s slightly similar with the variety planted","Kenya","Male","LessPreferred",3538
"Livestock feed","It`s only good for livestock","Kenya","Female","LessPreferred",3539
"Resilience","Minimum production","Kenya","Male","LessPreferred",3540
"Food and fodder","The variety is almost same as the farmer`s variety","Kenya","Male","LessPreferred",3541
"Livestock feed","The variety has more fertiliser requirement","Kenya","Male","LessPreferred",3542
"Green maize","The farmer preferes a variety that can be dried and stored for later use","Kenya","Female","LessPreferred",3543
"Family nutrition","The variety has yellow grain which may scare children","Kenya","Male","LessPreferred",3544
"Livestock feed","The variety is mainly suitable for feeding livestock while the farmer preferes a variety that can be used as food for her children","Kenya","Female","LessPreferred",3545
"Green maize","My interest it to have more dry maize to feed my family, as compared to the green maize which you can`t keep for long.","Kenya","Female","LessPreferred",3546
"Family nutrition","Can easily be affected by diseases which causes yield loss.","Kenya","Male","LessPreferred",3547
"Green maize","Incase of diseases, there is yield loss.","Kenya","Female","LessPreferred",3548
"Home use","we need an all purpose variety with more than one importance, eg can produce enough for the household and also the livestock.","Kenya","Male","LessPreferred",3549
"Green maize","Mostly its value, is attached to the maize while green.","Kenya","Female","LessPreferred",3550
"Drought avoidance","Because it takes 3 and half months to mature just like my normal variety.","Kenya","Male","LessPreferred",3551
"Green maize","It has low market prices and demand.","Kenya","Female","LessPreferred",3552
"Green maize","It`s of low market as compared to the other varieties.","Kenya","Female","LessPreferred",3553
"Livestock feed","It can`t resist drought and diseases.","Kenya","Female","LessPreferred",3554
"Family nutrition","Yellow in colour which has low market demand","Kenya","Female","LessPreferred",3555
"Home use","Uses more fertlizer and has single use","Kenya","Male","LessPreferred",3556
"Livestock feed","Need for food security not livestock feed","Kenya","Female","LessPreferred",3557
"Resilience","Uses a lot of fertilizer","Kenya","Male","LessPreferred",3558
"Family nutrition","Its yellow in color","Kenya","Female","LessPreferred",3559
"Livestock feed","Mainly meant for feeding livestock","Kenya","Male","LessPreferred",3560
"Food and fodder","Huge benefit is based on livestock.","Kenya","Male","LessPreferred",3561
"Intercropping (with beans)","Incase of diseases there is yield loss, its harvest per acre is low.","Kenya","Female","LessPreferred",3562
"Livestock feed","Mostly focuses on livestock.","Kenya","Female","LessPreferred",3563
"Livestock feed","Focuses more on feeding livestock, we want food for the household.","Kenya","Female","LessPreferred",3564
"Food and fodder","The fodder part should be considered later, the most important is food for the household.","Kenya","Male","LessPreferred",3565
"Drought avoidance","Low production","Kenya","Female","LessPreferred",3566
"Food and fodder","It`s same as the variety planted as also used to feed animals","Kenya","Female","LessPreferred",3567
"Family nutrition","Not interested with yellow colour maize","Kenya","Male","LessPreferred",3568
"Green maize","Not good for ugali","Kenya","Male","LessPreferred",3569
"Resilience","Medium production","Kenya","Female","LessPreferred",3570
"Drought avoidance","The variety has low yield","Kenya","Male","LessPreferred",3571
"Green maize","The variety is for green maize use while the farmer preferes a variety that can be used as food and also dried and sold","Kenya","Male","LessPreferred",3572
"Family nutrition","The yellow grain is unpopular hence not accepted by many in the market","Kenya","Male","LessPreferred",3573
"Livestock feed","The farmer do not prefer planting maize majorly for use as livestock feed","Kenya","Male","LessPreferred",3574
"Livestock feed","The farmer preferes a variety that can feed her family while this variety is majorly suitable for feeding livestock","Kenya","Female","LessPreferred",3575
"Drought avoidance","Less yields","Kenya","Male","LessPreferred",3576
"Green maize","No market for green maize.","Kenya","Female","LessPreferred",3577
"Green maize","Prefers dry maize for home use than green maize","Kenya","Male","LessPreferred",3578
"Family nutrition","The other varieties` benefits outweigh benefits of this variety","Kenya","Female","LessPreferred",3579
"Home use","The benefits are more less than the other varieties","Kenya","Female","LessPreferred",3580
"Intercropping (with beans)","Almost similar to what the farmer grows every season","Kenya","Female","LessPreferred",3581
"Livestock feed","Because it has poor market demand","Kenya","Female","LessPreferred",3582
"Green maize","Because it is tempting as the farmer can eat all before they dry","Kenya","Female","LessPreferred",3583
"Livestock feed","Because its only used as animal feed which is not a priority to the farmer","Kenya","Male","LessPreferred",3584
"Family nutrition","Because of its bad colour","Kenya","Female","LessPreferred",3585
"Livestock feed","Has no many livestock","Kenya","Female","LessPreferred",3586
"Home use","Average production","Kenya","Male","LessPreferred",3587
"Food and fodder","Can be substituted with resilient variety","Kenya","Male","LessPreferred",3588
"Home use","Medium production in case of pests and diseases","Kenya","Male","LessPreferred",3589
"Green maize","Fear of theft","Kenya","Male","LessPreferred",3590
"Home use","It has similar characteristics to the variety the farmer planted","Kenya","Male","LessPreferred",3591
"Green maize","It`s mainly grown for sale while the farmer prefers a seed variety for home consumption","Kenya","Female","LessPreferred",3592
"Intercropping (with beans)","The seed concept variety characteristics are found in the variety the farmer uses","Kenya","Male","LessPreferred",3593
"Green maize","Because of its good taste, the entire plantation will be consumed by the family while still green","Kenya","Male","LessPreferred",3594
"Livestock feed","Its grown mainly for animal Feeds while the farmer prefers a seed variety for consumption","Kenya","Male","LessPreferred",3595
"Intercropping (with beans)","No reason","Kenya","Female","LessPreferred",3596
"Livestock feed","Feed processing is difficult and expensive","Kenya","Female","LessPreferred",3597
"Green maize","Marketing problems","Kenya","Female","LessPreferred",3598
"Resilience","No reason","Kenya","Female","LessPreferred",3599
"Livestock feed","I am just not interested","Kenya","Female","LessPreferred",3600
"Livestock feed","This Might Be Difricult To Find Market For It And It Is Weak In Times Of Drought And Diseases","Uganda","Male","LessPreferred",3601
"Resilience","According To The Three Veriaties I Would Choose This Because It Has The Same Purposes Like The Oter I Had Picked","Uganda","Male","LessPreferred",3602
"Livestock feed","This Veriaty Has No Marketit Is Weak And It Needs Alot Of Fertilizers","Uganda","Male","LessPreferred",3603
"Green maize","Acdorsing To Three Veriaties I Would Choose This Since There`S Limited Market For The Green Maize","Uganda","Female","LessPreferred",3604
"Food and fodder","According To The Three Verieties I Would Take This One Since I Don`T Have Cows Now But All Verieties Are Good","Uganda","Male","LessPreferred",3605
"Livestock feed","Because Its Specifically For Pigs And I Don`T Rear Pigs","Uganda","Female","LessPreferred",3606
"Intercropping (with beans)","Because It Takes Alot Of Space When Planting It","Uganda","Male","LessPreferred",3607
"Green maize","Because It Is Best When Sold Fresh And For Us We Only Have Market For Dried Maize","Uganda","Female","LessPreferred",3608
"Livestock feed","Because It Can Be Eaten By People","Uganda","Female","LessPreferred",3609
"Intercropping (with beans)","It Consumes A Lot Of Land Because Of Spacing","Uganda","Male","LessPreferred",3610
"Food and fodder","Don`T Have Animals","Uganda","Male","LessPreferred",3611
"Intercropping (with beans)","Little Harvest","Uganda","Female","LessPreferred",3612
"Resilience","Not Good Here","Uganda","Female","LessPreferred",3613
"Resilience","Takes Long Time To Maturity","Uganda","Female","LessPreferred",3614
"Livestock feed","Rarely Rears Animals","Uganda","Female","LessPreferred",3615
"Livestock feed","Not Popular On The Market.","Uganda","Female","LessPreferred",3616
"Drought avoidance","Gives Low Output At Harvest Period.","Uganda","Male","LessPreferred",3617
"Resilience","Similar To Mine.","Uganda","Male","LessPreferred",3618
"Resilience","Its Similar To Mine.","Uganda","Female","LessPreferred",3619
"Livestock feed","It`S Labour Intensive And Has No Market.","Uganda","Male","LessPreferred",3620
"Resilience","It`S Slightly Similar To The Variety I Intend To Plant.","Uganda","Female","LessPreferred",3621
"Food and fodder","Has No Market.","Uganda","Male","LessPreferred",3622
"Family nutrition","Has No Market.","Uganda","Female","LessPreferred",3623
"Food and fodder","I Have No Animals And It Has Less Market.","Uganda","Male","LessPreferred",3624
"Family nutrition","Has No Market.","Uganda","Male","LessPreferred",3625
"Livestock feed","The Yellow Colour Makes It Difficult To Get Market","Uganda","Male","LessPreferred",3626
"Food and fodder","According To The Three Verieties It Would Be This Veriety Due To The Fact That I Do Not Have Cows","Uganda","Female","LessPreferred",3627
"Family nutrition","It Has No Market Acdording To It`S Yellow Colour","Uganda","Female","LessPreferred",3628
"Livestock feed","The Fact That It Has No Market Due To Its Yellow Colour","Uganda","Male","LessPreferred",3629
"Intercropping (with beans)","She Doesnt Want To Grow Maize With Beans","Uganda","Female","LessPreferred",3630
"Home use","This Is Good For Humans Where As He Is A Livestock Farmer","Uganda","Male","LessPreferred",3631
"Family nutrition","Does Not Have Market","Uganda","Male","LessPreferred",3632
"Livestock feed","Has No Market","Uganda","Female","LessPreferred",3633
"Family nutrition","No Market","Uganda","Female","LessPreferred",3634
"Food and fodder","Don`T Have Animals","Uganda","Female","LessPreferred",3635
"Green maize","Because It`S Similar To The One I Always Grow","Uganda","Male","LessPreferred",3636
"Family nutrition","Because Its Yellow In Color And Yellow Maize Has No Market","Uganda","Male","LessPreferred",3637
"Livestock feed","It Needs Alot Of Fertilizers To Grow Well And It Doesn`T Have Enough Market","Uganda","Female","LessPreferred",3638
"Livestock feed","It Is Not Resistant To Diseases And Drought","Uganda","Male","LessPreferred",3639
"Intercropping (with beans)","It It Consumes Land Because Of Spacing","Uganda","Female","LessPreferred",3640
"Family nutrition","It May Be Hectic To Get Market For It","Uganda","Female","LessPreferred",3641
"Green maize","Limited Market","Uganda","Male","LessPreferred",3642
"Livestock feed","Limited Market For The Crop","Uganda","Female","LessPreferred",3643
"Family nutrition","It Has Yelliw Colour And Market May Be Limited","Uganda","Male","LessPreferred",3644
"Livestock feed","It Is Specifically For Animals.It Is Well Explsined","Uganda","Male","LessPreferred",3645
"Drought avoidance","It Does Not Have Vitamin A","Uganda","Female","LessPreferred",3646
"Green maize","There Is No Market For Frsh Maize.","Uganda","Male","LessPreferred",3647
"Livestock feed","It Is Specifically For Animals.Th","Uganda","Female","LessPreferred",3648
"Resilience","All Your Maize Is Resistant To Drought And Diseases","Uganda","Male","LessPreferred",3649
"Livestock feed","I Intend To Start Keeping Animals On A Large Scale","Uganda","Male","LessPreferred",3650
"Green maize","It`S The Same Maize As We Have Already","Uganda","Female","LessPreferred",3651
"Family nutrition","The Market Is Not Readily Available","Uganda","Female","LessPreferred",3652
"Green maize","It Might Be Hard To Get Ready Market For The Green Maize","Uganda","Female","LessPreferred",3653
"Drought avoidance","It Might Lead To Heavy Losses If Delayed To Plant It","Uganda","Male","LessPreferred",3654
"Family nutrition","Its Yellow Colour Makes Hard To Get Market","Uganda","Male","LessPreferred",3655
"Drought avoidance","It Needs More Fertilisers Which Maybe Difficult For Her To Manage","Uganda","Female","LessPreferred",3656
"Family nutrition","This Maize Variety Has No Market In The Community","Uganda","Male","LessPreferred",3657
"Livestock feed","This Maize Variety Is For Feeding Animal`S","Uganda","Male","LessPreferred",3658
"Intercropping (with beans)","This Maize Variety Will Need More Labor And Care Which She May Not Have","Uganda","Female","LessPreferred",3659
"Resilience","This Maize Variety Grows Within Four Months And Her Grows Within Three Months And A Half","Uganda","Female","LessPreferred",3660
"Resilience","It Matures In Four Months.The Information Is Wee","Uganda","Female","LessPreferred",3661
"Livestock feed","It Does Not Have Ready Market.","Uganda","Female","LessPreferred",3662
"Green maize","In This Village There Is No Market For Fresh Maize.","Uganda","Male","LessPreferred",3663
"Livestock feed","It Does Not Have Ready Market.","Uganda","Male","LessPreferred",3664
"Intercropping (with beans)","It May Give Low Yields Compared To Others","Uganda","Female","LessPreferred",3665
"Home use","It May Not Give Out Alot Of Money","Uganda","Male","LessPreferred",3666
"Livestock feed","I Dont Keep Animals To Feed On It And Can Hardly Get Market","Uganda","Female","LessPreferred",3667
"Green maize","It May Have Limited Market","Uganda","Male","LessPreferred",3668
"Food and fodder","Almost The Same As What We Grow","Uganda","Male","LessPreferred",3669
"Resilience","Would Have Loved All But Have To Make A Choice","Uganda","Female","LessPreferred",3670
"Livestock feed","It`S Only For Animals","Uganda","Male","LessPreferred",3671
"Livestock feed","I Can`T Grow Something I Don`T Eat","Uganda","Female","LessPreferred",3672
"Intercropping (with beans)","It`S The Same With His Variety","Uganda","Male","LessPreferred",3673
"Green maize","The Green Maize Might Be Good Only When You Grow It Early Enough But If You Delay One May Not Get Good Market","Uganda","Male","LessPreferred",3674
"Family nutrition","Because Of Its Colour Which Makes It Hard For People To Understand It In The Market","Uganda","Female","LessPreferred",3675
"Livestock feed","Its Colour Makes It Hard To Get Market","Uganda","Female","LessPreferred",3676
"Home use","This Maize Variety Can Be Intercropped And It Yields Good Maize Cobs","Uganda","Male","LessPreferred",3677
"Home use","This Maize Variety Is Mostly For Human Consumption","Uganda","Male","LessPreferred",3678
"Drought avoidance","This Maize Variety Requires Fertilizers To Do Well","Uganda","Female","LessPreferred",3679
"Food and fodder","This Maize Variety Can Provide Feed To Animals That She Doesn`T Rear","Uganda","Female","LessPreferred",3680
"Livestock feed","We Have Lost Our Animals In Our Community Because Of Diseases Thus No Farmers To Use This Type","Uganda","Male","LessPreferred",3681
"Green maize","Limited Market For This","Uganda","Male","LessPreferred",3682
"Food and fodder","It May Have Low Yields","Uganda","Female","LessPreferred",3683
"Livestock feed","It Does Not Have Ready Market.","Uganda","Male","LessPreferred",3684
"Livestock feed","It Is Specifically For Animals.","Uganda","Female","LessPreferred",3685
"Family nutrition","Yellow Maize Variety Does Not Have Ready Market.","Uganda","Male","LessPreferred",3686
"Food and fodder","It Is Not Highly Productive.","Uganda","Female","LessPreferred",3687
"Family nutrition","This Maize Variety Has Low Market In The Community","Uganda","Male","LessPreferred",3688
"Green maize","She Grows Maize For Posho Production","Uganda","Female","LessPreferred",3689
"Home use","This Maize Variety Takes Four Months To Mature","Uganda","Male","LessPreferred",3690
"Resilience","This Maize Variety Requires Fertilizers","Uganda","Female","LessPreferred",3691
"Livestock feed","Its Yellow Colour Because Because It`S Hard To Look For Customers With Pigs And Chicken","Uganda","Female","LessPreferred",3692
"Family nutrition","Its Yellow Colour Which Makes It Hard In Selling Since Most People Are Not Interested In The Colour","Uganda","Male","LessPreferred",3693
"Green maize","There`S No Business For Selling Green Maize In This Village","Uganda","Female","LessPreferred",3694
"Livestock feed","It Works Better For Those With Pigs And Chicken","Uganda","Male","LessPreferred",3695
"Livestock feed","It`S Only For Only Animals","Uganda","Male","LessPreferred",3696
"Family nutrition","There Is No Market For Orange Maize","Uganda","Male","LessPreferred",3697
"Family nutrition","No Market For Orange Maize","Uganda","Female","LessPreferred",3698
"Livestock feed","It`S Only For Animals Not People","Uganda","Female","LessPreferred",3699
"Green maize","It Has Limited Market","Uganda","Female","LessPreferred",3700
"Food and fodder","It Is Not As Good As The First Variety Thus The Drought Avoidance Variety","Uganda","Male","LessPreferred",3701
"Livestock feed","It Requires Alot Of Fertilizers For You To Gain From It And It Is Not Drought Resistant","Uganda","Male","LessPreferred",3702
"Food and fodder","I Dont Keep Animals So This Is For People Who Rear Animals","Uganda","Female","LessPreferred",3703
"Drought avoidance","It Is For Only Animals","Uganda","Male","LessPreferred",3704
"Food and fodder","Because It Is Even For Animals And Yet He Does Not Rear Any Cattle.","Uganda","Male","LessPreferred",3705
"Home use","Because It Is Only For Home Consumption And Selling.","Uganda","Male","LessPreferred",3706
"Intercropping (with beans)","The Yields May Be Low Because Of Jntercropping.","Uganda","Male","LessPreferred",3707
"Livestock feed","Because It Has No Market And Mainly For Animals.","Uganda","Female","LessPreferred",3708
"Food and fodder","There Are Not Many Livestock Farmers To Market Variety To","Uganda","Male","LessPreferred",3709
"Green maize","There Is No Market For Raw Maize Here","Uganda","Female","LessPreferred",3710
"Livestock feed","Not Profitable In This Area","Uganda","Male","LessPreferred",3711
"Drought avoidance","Because It Only Survives During Drought Conditions","Uganda","Female","LessPreferred",3712
"Family nutrition","Its Not Marketbke","Uganda","Female","LessPreferred",3713
"Resilience","Because It Requires Alot Of Fertilisers.","Uganda","Female","LessPreferred",3714
"Food and fodder","Because There Is No Market For It Here","Uganda","Female","LessPreferred",3715
"Livestock feed","It Is For Animals Only","Uganda","Female","LessPreferred",3716
"Green maize","Its Delicious When Green And Yet I Grow To Sell Dry Maize","Uganda","Female","LessPreferred",3717
"Livestock feed","Easily Affected By Drought","Uganda","Male","LessPreferred",3718
"Family nutrition","Yellow Maize Doent Have Market","Uganda","Female","LessPreferred",3719
"Livestock feed","We Dont Rear Animals Like Pigs","Uganda","Male","LessPreferred",3720
"Livestock feed","This Maize Variety Is For Feeding Animal`S And Has Little Market In The Community","Uganda","Male","LessPreferred",3721
"Drought avoidance","This Maize Variety Requires Fertilizers To Grow Well","Uganda","Male","LessPreferred",3722
"Green maize","This Maize Variety Matures Within Four Months","Uganda","Female","LessPreferred",3723
"Livestock feed","This Maize Variety For Feeding Animal`S She Wants Maize Varieties That Produces Human Food","Uganda","Female","LessPreferred",3724
"Home use","It`S The Maize We Have","Uganda","Female","LessPreferred",3725
"Intercropping (with beans)","It`S The Maize We Use Already","Uganda","Female","LessPreferred",3726
"Livestock feed","It`S Only For Animals Not For People","Uganda","Male","LessPreferred",3727
"Food and fodder","Have No Animals And It`S The Maize We Have","Uganda","Male","LessPreferred",3728
"Family nutrition","Because Of Its Yellow Which Is Not Wanted In The Market","Uganda","Male","LessPreferred",3729
"Livestock feed","It`S Only Good For Those With Pigs And Birds","Uganda","Male","LessPreferred",3730
"Resilience","Because Its Almost The Same With Hec Variety","Uganda","Female","LessPreferred",3731
"Livestock feed","Buyers Are Always Reject The Yellow Maize","Uganda","Female","LessPreferred",3732
"Green maize","There Is No Market For Fresh Maize In My Village.","Uganda","Male","LessPreferred",3733
"Intercropping (with beans)","Low Yield Are Expected.","Uganda","Male","LessPreferred",3734
"Livestock feed","It Is Specifically For Animals.","Uganda","Female","LessPreferred",3735
"Food and fodder","It Matures In 4 Months.","Uganda","Female","LessPreferred",3736
"Home use","It Does Not Give Alot For Sales.","Uganda","Male","LessPreferred",3737
"Livestock feed","It May Have Limited Market","Uganda","Male","LessPreferred",3738
"Livestock feed","It Has Limited Market","Uganda","Female","LessPreferred",3739
"Home use","Sales May Be Minimal","Uganda","Female","LessPreferred",3740
"Home use","This Maize Variety Grows Within Four Months","Uganda","Female","LessPreferred",3741
"Livestock feed","This Maize Variety Is Good For Feeding Animal`S But Has Little Market In The Community","Uganda","Male","LessPreferred",3742
